<?xml version="1.0" encoding="UTF-8"?>
<xs:schema xmlns:xs="http://www.w3.org/2001/XMLSchema">

    <xs:element name="Eemploi_de_temps">
        <xs:complexType>
            <xs:sequence>
                <xs:element name="Filiere" maxOccurs="unbounded">
                    <xs:complexType>
                        <xs:sequence>
                            <xs:element name="Jour" maxOccurs="unbounded">
                                <xs:complexType>
                                    <xs:sequence>
                                        <xs:element name="Module" maxOccurs="unbounded">
                                            <xs:complexType>
                                                <xs:sequence>
                                                    <xs:element name="Creneau" maxOccurs="unbounded">
                                                        <xs:complexType>
                                                            <xs:sequence>
                                                                <xs:element name="Heure" type="xs:string"/>
                                                                <xs:element name="Prof" type="xs:string"/>
                                                                <xs:element name="Salle" type="xs:string"/>
                                                            </xs:sequence>
                                                            <xs:attribute name="type" use="required">
                                                                <xs:simpleType>
                                                                    <xs:restriction base="xs:string">
                                                                        <xs:enumeration value="CM"/>
                                                                        <xs:enumeration value="TD"/>
                                                                        <xs:enumeration value="TP"/>
                                                                    </xs:restriction>
                                                                </xs:simpleType>
                                                            </xs:attribute>
                                                        </xs:complexType>
                                                    </xs:element>
                                                </xs:sequence>
                                                <xs:attribute name="nom" type="xs:string" use="required"/>
                                            </xs:complexType>
                                        </xs:element>
                                    </xs:sequence>
                                    <xs:attribute name="nom" type="xs:string" use="required"/>
                                    <xs:attribute name="date" type="xs:string" use="required"/>
                                </xs:complexType>
                            </xs:element>
                        </xs:sequence>
                        <xs:attribute name="nom" type="xs:string" use="required"/>
                    </xs:complexType>
                </xs:element>
            </xs:sequence>
        </xs:complexType>
    </xs:element>

</xs:schema>
